{"id":"dispatch_scenario.elven_rot_response.prototype","kind":"dispatch_scenario","seed":4203,"actor":{"actorDefinitionId":"actor_def.elven.grove_tender","factionId":"faction.elves.prototype","producerSiteId":"site.elven.heart_grove.level_4.prototype","rallyPointId":"rally.heart_grove.root_gate","role":"worker"},"candidates":[{"actionId":"dispatch.elves.cleanse_canopy_rot","assignment":"pursue_faction_goal","targetNodeId":"network_node.old_canopy_road","scoreTerms":{"goal_progress":18,"target_threat":9,"faction_hatred":10,"expected_loot":1,"strategic_position":12,"supply_cost":-2,"travel_risk":-3,"home_defense_deficit":-1,"role_fitness":12},"wobble":-0.1,"total":55.9},{"actionId":"dispatch.elves.reinforce_heart_grove","assignment":"defend","targetNodeId":"network_node.reception_terrace","scoreTerms":{"goal_progress":5,"target_threat":7,"faction_hatred":3,"expected_loot":0,"strategic_position":8,"supply_cost":-1,"travel_risk":-1,"home_defense_deficit":8,"role_fitness":6},"wobble":0.2,"total":35.2}],"chosenActionId":"dispatch.elves.cleanse_canopy_rot"}
