{"id":"dispatch_scenario.colonial_reinforcement.prototype","kind":"dispatch_scenario","seed":4201,"actor":{"actorDefinitionId":"actor_def.colonial.line_marine","factionId":"faction.colonial_powers.prototype","producerSiteId":"site.colonial.watch_fort.level_2.prototype","rallyPointId":"rally.colonial.watch_fort.gate","role":"soldier"},"candidates":[{"actionId":"dispatch.colonial.reinforce_river_fork","assignment":"reinforce","targetNodeId":"network_node.river_fork","scoreTerms":{"goal_progress":12,"target_threat":18,"faction_hatred":4,"expected_loot":0,"strategic_position":16,"supply_cost":-3,"travel_risk":-4,"home_defense_deficit":-2,"role_fitness":10},"wobble":0.2,"total":51.2},{"actionId":"dispatch.colonial.raid_smuggler_cove","assignment":"raid","targetNodeId":"network_node.smuggler_cove","scoreTerms":{"goal_progress":6,"target_threat":2,"faction_hatred":12,"expected_loot":11,"strategic_position":5,"supply_cost":-8,"travel_risk":-9,"home_defense_deficit":-2,"role_fitness":7},"wobble":-0.1,"total":23.9}],"chosenActionId":"dispatch.colonial.reinforce_river_fork"}
