{"id":"dispatch_scenario.cthulhu_ritual_dispatch.prototype","kind":"dispatch_scenario","seed":4204,"actor":{"actorDefinitionId":"actor_def.cthulhu.brine_wraith","factionId":"faction.cthulhu.prototype","producerSiteId":"site.drowned_shrine.level_5.prototype","rallyPointId":"rally.drowned_shrine.processional_gate","role":"supernatural"},"candidates":[{"actionId":"dispatch.cthulhu.corrupt_river_fork","assignment":"pursue_faction_goal","targetNodeId":"network_node.river_fork","scoreTerms":{"goal_progress":22,"target_threat":5,"faction_hatred":4,"expected_loot":0,"strategic_position":15,"supply_cost":-2,"travel_risk":-2,"home_defense_deficit":0,"role_fitness":11},"wobble":0.1,"total":53.1},{"actionId":"dispatch.cthulhu.attack_elven_grove","assignment":"attack","targetNodeId":"network_node.old_canopy_road","scoreTerms":{"goal_progress":8,"target_threat":8,"faction_hatred":15,"expected_loot":2,"strategic_position":7,"supply_cost":-5,"travel_risk":-7,"home_defense_deficit":0,"role_fitness":8},"wobble":-0.2,"total":35.8}],"chosenActionId":"dispatch.cthulhu.corrupt_river_fork"}
